{
  "$schema": "./codex-crew-dispatch.v2.schema.json",
  "schema_version": "codex-crew.dispatch.v2",
  "execution_topology": "worker_parallel",
  "profile": "full",
  "worker_profile": "worker-full-terra-high",
  "repository_root": "D:/CodeSpace/example-repository",
  "parent_run_id": "replace-with-parent-run-id",
  "parent_thread_id": "replace-with-parent-thread-id",
  "max_active_write_worktrees": 2,
  "parallelism_rationale": "DTO 已冻结；实现与测试写入职责互斥且可独立验证。",
  "tasks": [
    {"id": "dto-implementation", "prompt": "实现已冻结 DTO 的服务映射。", "depends_on": [], "write_ownership": {"paths": ["src/service"], "external_resources": []}, "worktree": {"path": "D:/CodeSpace/example-repository-wt/dto-implementation", "branch": "codex/dto-implementation", "base_ref": "HEAD"}},
    {"id": "dto-tests", "prompt": "补充 DTO contract 测试。", "depends_on": [], "write_ownership": {"paths": ["tests/contract"], "external_resources": []}, "worktree": {"path": "D:/CodeSpace/example-repository-wt/dto-tests", "branch": "codex/dto-tests", "base_ref": "HEAD"}}
  ]
}
